CustomerCD,CustomerName,Gender,Age,BirthDate
CT1447,"Mellinger, Miss. Madeleine Violet",female,23,1999-09-06
CT1448,"Seward, Mr. Frederic Kimber",male,44,1979-03-19
CT1449,"Baclini, Miss. Marie Catherine",female,15,2007-06-24
CT1450,"Peuchen, Major. Arthur Godfrey",male,62,1961-09-01
CT1451,"West, Mr. Edwy Arthur",male,46,1977-04-06
CT1452,"Hagland, Mr. Ingvald Olai Olsen",male,27,2012-05-08
CT1453,"Foreman, Mr. Benjamin Laventall",male,40,1983-02-10
CT1454,"Goldenberg, Mr. Samuel L",male,59,1964-08-04
CT1455,"Peduzzi, Mr. Joseph",male,27,2012-05-08
CT1456,"Jalsevac, Mr. Ivan",male,39,1984-02-01
CT1457,"Millet, Mr. Francis Davis",male,75,1948-12-30
CT1458,"Kenyon, Mrs. Frederick R (Marion)",female,27,2012-05-08
CT1459,"Toomey, Miss. Ellen",female,60,1963-08-14
CT1460,"O'Connor, Mr. Maurice",male,27,2012-05-08
CT1461,"Anderson, Mr. Harry",male,58,1965-07-26
CT1462,"Morley, Mr. William",male,44,1979-03-19
CT1463,"Gee, Mr. Arthur H",male,57,1966-07-17
CT1464,"Milling, Mr. Jacob Christian",male,58,1965-07-26
CT1465,"Maisner, Mr. Simon",male,27,2012-05-08
CT1466,"Goncalves, Mr. Manuel Estanslas",male,48,1975-04-25
CT1467,"Campbell, Mr. William",male,27,2012-05-08
CT1468,"Smart, Mr. John Montgomery",male,66,1957-10-08
CT1469,"Scanlan, Mr. James",male,27,2012-05-08
CT1470,"Baclini, Miss. Helene Barbara",female,27,2012-05-08
CT1471,"Keefe, Mr. Arthur",male,27,2012-05-08
CT1472,"Cacic, Mr. Luka",male,48,1975-04-25
CT1473,"West, Mrs. Edwy Arthur (Ada Mary Worth)",female,43,1980-03-09
CT1474,"Jerwan, Mrs. Amin S (Marie Marthe Thuillard)",female,33,1989-12-07
CT1475,"Strandberg, Miss. Ida Sofia",female,32,1990-11-28
CT1476,"Clifford, Mr. George Quincy",male,27,2012-05-08
CT1477,"Renouf, Mr. Peter Henry",male,44,1979-03-19
CT1478,"Braund, Mr. Lewis Richard",male,39,1984-02-01
CT1479,"Karlsson, Mr. Nils August",male,32,1990-11-28
CT1480,"Hirvonen, Miss. Hildur E",female,12,2010-05-27
CT1481,"Goodwin, Master. Harold Victor",male,19,2003-07-31
CT1482,"Frost, Mr. Anthony Wood ""Archie""",male,27,2012-05-08
CT1483,"Rouse, Mr. Richard Henry",male,60,1963-08-14
CT1484,"Turkula, Mrs. (Hedwig)",female,73,1950-12-12
CT1485,"Bishop, Mr. Dickinson H",male,35,1987-12-26
CT1486,"Lefebre, Miss. Jeannie",female,27,2012-05-08
CT1487,"Hoyt, Mrs. Frederick Maxfield (Jane Anne Forby)",female,45,1978-03-28
CT1488,"Kent, Mr. Edward Austin",male,68,1955-10-27
CT1489,"Somerton, Mr. Francis William",male,40,1983-02-10
CT1490,"Coutts, Master. Eden Leslie ""Neville""",male,19,2003-07-31
CT1491,"Hagland, Mr. Konrad Mathias Reiersen",male,27,2012-05-08
CT1492,"Windelov, Mr. Einar",male,31,1991-11-19
CT1493,"Molson, Mr. Harry Markland",male,65,1958-09-29
CT1494,"Artagaveytia, Mr. Ramon",male,81,1943-02-24
CT1495,"Stanley, Mr. Edward Roland",male,31,1991-11-19
CT1496,"Yousseff, Mr. Gerious",male,27,2012-05-08
CT1497,"Eustis, Miss. Elizabeth Mussey",female,64,1959-09-20
CT1498,"Shellard, Mr. Frederick William",male,27,2012-05-08
CT1499,"Allison, Mrs. Hudson J C (Bessie Waldo Daniels)",female,35,1987-12-26
CT1500,"Svensson, Mr. Olof",male,34,1988-12-16
CT1501,"Calic, Mr. Petar",male,27,1995-10-13
CT1502,"Canavan, Miss. Mary",female,31,1991-11-19
CT1503,"O'Sullivan, Miss. Bridget Mary",female,27,2012-05-08
CT1504,"Laitinen, Miss. Kristina Sofia",female,47,1976-04-15
CT1505,"Maioni, Miss. Roberta",female,26,1996-10-03
CT1506,"Penasco y Castellana, Mr. Victor de Satode",male,28,1994-10-22
CT1507,"Quick, Mrs. Frederick Charles (Jane Richards)",female,43,1980-03-09
CT1508,"Bradley, Mr. George (""George Arthur Brayton"")",male,27,2012-05-08
CT1509,"Olsen, Mr. Henry Margido",male,38,1985-01-22
CT1510,"Lang, Mr. Fang",male,36,1987-01-04
CT1511,"Daly, Mr. Eugene Patrick",male,39,1984-02-01
CT1512,"Webber, Mr. James",male,27,2012-05-08
CT1513,"McGough, Mr. James Robert",male,46,1977-04-06
CT1514,"Rothschild, Mrs. Martin (Elizabeth L. Barrett)",female,64,1959-09-20
CT1515,"Coleff, Mr. Satio",male,34,1988-12-16
CT1516,"Walker, Mr. William Anderson",male,57,1966-07-17
CT1517,"Lemore, Mrs. (Amelia Milley)",female,44,1979-03-19
CT1518,"Ryan, Mr. Patrick",male,27,2012-05-08
CT1519,"Angle, Mrs. William A (Florence ""Mary"" Agnes Hughes)",female,46,1977-04-06
CT1520,"Pavlovic, Mr. Stefo",male,42,1981-02-28
CT1521,"Perreault, Miss. Anne",female,40,1983-02-10
CT1522,"Vovk, Mr. Janko",male,32,1990-11-28
CT1523,"Lahoud, Mr. Sarkis",male,27,2012-05-08
CT1524,"Hippach, Mrs. Louis Albert (Ida Sophia Fischer)",female,54,1969-06-19
CT1525,"Kassem, Mr. Fared",male,27,2012-05-08
CT1526,"Farrell, Mr. James",male,50,1973-05-13
CT1527,"Ridsdale, Miss. Lucy",female,60,1963-08-14
CT1528,"Farthing, Mr. John",male,27,2012-05-08
CT1529,"Salonen, Mr. Johan Werner",male,49,1974-05-04
CT1530,"Hocking, Mr. Richard George",male,33,1989-12-07
CT1531,"Quick, Miss. Phyllis May",female,12,2010-05-27
CT1532,"Toufik, Mr. Nakli",male,27,2012-05-08
CT1533,"Elias, Mr. Joseph Jr",male,27,1995-10-13
CT1534,"Peter, Mrs. Catherine (Catherine Rizk)",female,27,2012-05-08
CT1535,"Cacic, Miss. Marija",female,40,1983-02-10
CT1536,"Hart, Miss. Eva Miriam",female,17,2005-07-12
CT1537,"Butt, Major. Archibald Willingham",male,55,1968-06-28
CT1538,"LeRoy, Miss. Bertha",female,40,1983-02-10
CT1539,"Risien, Mr. Samuel Beard",male,27,2012-05-08
CT1540,"Frolicher, Miss. Hedwig Margaritha",female,32,1990-11-28
CT1541,"Crosby, Miss. Harriet R",female,46,1977-04-06
CT1542,"Andersson, Miss. Ingeborg Constanzia",female,19,2003-07-31
CT1543,"Andersson, Miss. Sigrid Elisabeth",female,21,2001-08-18
CT1544,"Beane, Mr. Edward",male,42,1981-02-28
CT1545,"Douglas, Mr. Walter Donald",male,60,1963-08-14
CT1546,"Nicholson, Mr. Arthur Ernest",male,74,1949-12-21
CT1547,"Beane, Mrs. Edward (Ethel Clarke)",female,29,1993-10-31
CT1548,"Padro y Manent, Mr. Julian",male,27,2012-05-08
CT1549,"Goldsmith, Mr. Frank John",male,43,1980-03-09
CT1550,"Davies, Master. John Morgan Jr",male,18,2004-07-21
CT1551,"Thayer, Mr. John Borland Jr",male,27,1995-10-13
CT1552,"Sharp, Mr. Percival James R",male,37,1986-01-13
CT1553,"O'Brien, Mr. Timothy",male,27,2012-05-08
CT1554,"Leeni, Mr. Fahim (""Philip Zenni"")",male,32,1990-11-28
CT1555,"Ohman, Miss. Velin",female,32,1990-11-28
CT1556,"Wright, Mr. George",male,72,1951-12-03
CT1557,"Duff Gordon, Lady. (Lucille Christiana Sutherland) (""Mrs Morgan"")",female,58,1965-07-26
CT1558,"Robbins, Mr. Victor",male,27,2012-05-08
CT1559,"Taussig, Mrs. Emil (Tillie Mandelbaum)",female,49,1974-05-04
CT1560,"de Messemaeker, Mrs. Guillaume Joseph (Emma)",female,46,1977-04-06
CT1561,"Morrow, Mr. Thomas Rowan",male,27,2012-05-08
CT1562,"Sivic, Mr. Husein",male,50,1973-05-13
CT1563,"Norman, Mr. Robert Douglas",male,38,1985-01-22
CT1564,"Simmons, Mr. John",male,27,2012-05-08
CT1565,"Meanwell, Miss. (Marion Ogden)",female,27,2012-05-08
CT1566,"Davies, Mr. Alfred J",male,34,1988-12-16
CT1567,"Stoytcheff, Mr. Ilia",male,29,1993-10-31
CT1568,"Palsson, Mrs. Nils (Alma Cornelia Berglund)",female,39,1984-02-01
CT1569,"Doharr, Mr. Tannous",male,27,2012-05-08
CT1570,"Jonsson, Mr. Carl",male,42,1981-02-28
CT1571,"Harris, Mr. George",male,72,1951-12-03
CT1572,"Appleton, Mrs. Edward Dale (Charlotte Lamson)",female,63,1960-09-10
CT1573,"Flynn, Mr. John Irwin (""Irving"")",male,46,1977-04-06
CT1574,"Kelly, Miss. Mary",female,27,2012-05-08
CT1575,"Rush, Mr. Alfred George John",male,26,1996-10-03
CT1576,"Patchett, Mr. George",male,29,1993-10-31
CT1577,"Garside, Miss. Ethel",female,44,1979-03-19
CT1578,"Silvey, Mrs. William Baird (Alice Munger)",female,49,1974-05-04
CT1579,"Caram, Mrs. Joseph (Maria Elias)",female,27,2012-05-08
CT1580,"Jussila, Mr. Eiriik",male,42,1981-02-28
CT1581,"Christy, Miss. Julie Rachel",female,35,1987-12-26
CT1582,"Thayer, Mrs. John Borland (Marian Longstreth Morris)",female,49,1974-05-04
CT1583,"Downton, Mr. William James",male,64,1959-09-20
CT1584,"Ross, Mr. John Hugo",male,46,1977-04-06
CT1585,"Paulner, Mr. Uscher",male,27,2012-05-08
CT1586,"Taussig, Miss. Ruth",female,28,1994-10-22
CT1587,"Jarvis, Mr. John Denzil",male,57,1966-07-17
CT1588,"Frolicher-Stehli, Mr. Maxmillian",male,70,1953-11-14
CT1589,"Gilinski, Mr. Eliezer",male,32,1990-11-28
CT1590,"Murdlin, Mr. Joseph",male,27,2012-05-08
CT1591,"Rintamaki, Mr. Matti",male,45,1978-03-28
CT1592,"Stephenson, Mrs. Walter Bertram (Martha Eustis)",female,62,1961-09-01
CT1593,"Elsbury, Mr. William James",male,57,1966-07-17
CT1594,"Bourke, Miss. Mary",female,27,2012-05-08
CT1595,"Chapman, Mr. John Henry",male,47,1976-04-15
CT1596,"Van Impe, Mr. Jean Baptiste",male,46,1977-04-06
CT1597,"Leitch, Miss. Jessie Wills",female,27,2012-05-08
CT1598,"Johnson, Mr. Alfred",male,59,1964-08-04
CT1599,"Boulos, Mr. Hanna",male,27,2012-05-08
CT1600,"Duff Gordon, Sir. Cosmo Edmund (""Mr Morgan"")",male,59,1964-08-04
CT1601,"Jacobsohn, Mrs. Sidney Samuel (Amy Frances Christy)",female,34,1988-12-16
CT1602,"Slabenoff, Mr. Petco",male,27,2012-05-08
CT1603,"Harrington, Mr. Charles H",male,27,2012-05-08
CT1604,"Torber, Mr. Ernst William",male,54,1969-06-19
CT1605,"Homer, Mr. Harry (""Mr E Haven"")",male,45,1978-03-28
CT1606,"Lindell, Mr. Edvard Bengtsson",male,46,1977-04-06
CT1607,"Karaic, Mr. Milan",male,40,1983-02-10
CT1608,"Daniel, Mr. Robert Williams",male,37,1986-01-13
CT1609,"Laroche, Mrs. Joseph (Juliette Marie Louise Lafargue)",female,32,1990-11-28
CT1610,"Shutes, Miss. Elizabeth W",female,50,1973-05-13
CT1611,"Andersson, Mrs. Anders Johan (Alfrida Konstantia Brogren)",female,49,1974-05-04
CT1612,"Jardin, Mr. Jose Neto",male,27,2012-05-08
CT1613,"Murphy, Miss. Margaret Jane",female,27,2012-05-08
CT1614,"Horgan, Mr. John",male,27,2012-05-08
CT1615,"Brocklebank, Mr. William Alfred",male,45,1978-03-28
CT1616,"Herman, Miss. Alice",female,34,1988-12-16
CT1617,"Danbom, Mr. Ernst Gilbert",male,44,1979-03-19
CT1618,"Lobb, Mrs. William Arthur (Cordelia K Stanlick)",female,36,1987-01-04
CT1619,"Becker, Miss. Marion Louise",female,14,2008-06-14
CT1620,"Gavey, Mr. Lawrence",male,36,1987-01-04
CT1621,"Yasbeck, Mr. Antoni",male,37,1986-01-13
CT1622,"Kimball, Mr. Edwin Nelson Jr",male,52,1971-06-01
CT1623,"Nakid, Mr. Sahid",male,30,1992-11-09
CT1624,"Hansen, Mr. Henry Damsgaard",male,31,1991-11-19
CT1625,"Bowen, Mr. David John ""Dai""",male,31,1991-11-19
CT1626,"Sutton, Mr. Frederick",male,71,1952-11-23
CT1627,"Kirkland, Rev. Charles Leonard",male,67,1956-10-17
CT1628,"Longley, Miss. Gretchen Fiske",female,31,1991-11-19
CT1629,"Bostandyeff, Mr. Guentcho",male,36,1987-01-04
CT1630,"O'Connell, Mr. Patrick D",male,27,2012-05-08
CT1631,"Barkworth, Mr. Algernon Henry Wilson",male,90,1934-05-18
CT1632,"Lundahl, Mr. Johan Svensson",male,61,1962-08-23
CT1633,"Stahelin-Maeglin, Dr. Max",male,42,1981-02-28
CT1634,"Parr, Mr. William Henry Marsh",male,27,2012-05-08
CT1635,"Skoog, Miss. Mabel",female,19,2003-07-31
CT1636,"Davis, Miss. Mary",female,38,1985-01-22
CT1637,"Leinonen, Mr. Antti Gustaf",male,42,1981-02-28
CT1638,"Collyer, Mr. Harvey",male,41,1982-02-19
CT1639,"Panula, Mrs. Juha (Maria Emilia Ojala)",female,51,1972-05-22
CT1640,"Thorneycroft, Mr. Percival",male,27,2012-05-08
CT1641,"Jensen, Mr. Hans Peder",male,30,1992-11-09
CT1642,"Sagesser, Mlle. Emma",female,34,1988-12-16
CT1643,"Skoog, Miss. Margit Elizabeth",female,12,2010-05-27
CT1644,"Foo, Mr. Choong",male,27,2012-05-08
CT1645,"Baclini, Miss. Eugenie",female,27,2012-05-08
CT1646,"Harper, Mr. Henry Sleeper",male,58,1965-07-26
CT1647,"Cor, Mr. Liudevit",male,29,1993-10-31
CT1648,"Simonius-Blumer, Col. Oberst Alfons",male,66,1957-10-08
CT1649,"Willey, Mr. Edward",male,27,2012-05-08
CT1650,"Stanley, Miss. Amy Zillah Elsie",female,33,1989-12-07
CT1651,"Mitkoff, Mr. Mito",male,27,2012-05-08
CT1652,"Doling, Miss. Elsie",female,28,1994-10-22
CT1653,"Kalvik, Mr. Johannes Halvorsen",male,31,1991-11-19
CT1654,"O'Leary, Miss. Hanora ""Norah""",female,27,2012-05-08
CT1655,"Hegarty, Miss. Hanora ""Nora""",female,28,1994-10-22
CT1656,"Hickman, Mr. Leonard Mark",male,34,1988-12-16
CT1657,"Radeff, Mr. Alexander",male,27,2012-05-08
CT1658,"Bourke, Mrs. John (Catherine)",female,42,1981-02-28
CT1659,"Eitemiller, Mr. George Floyd",male,33,1989-12-07
CT1660,"Newell, Mr. Arthur Webster",male,68,1955-10-27
CT1661,"Frauenthal, Dr. Henry William",male,60,1963-08-14
CT1662,"Badt, Mr. Mohamed",male,50,1973-05-13
CT1663,"Colley, Mr. Edward Pomeroy",male,57,1966-07-17
CT1664,"Coleff, Mr. Peju",male,46,1977-04-06
CT1665,"Lindqvist, Mr. Eino William",male,30,1992-11-09
CT1666,"Hickman, Mr. Lewis",male,42,1981-02-28
CT1667,"Butler, Mr. Reginald Fenton",male,35,1987-12-26
CT1668,"Rommetvedt, Mr. Knud Paust",male,27,2012-05-08
CT1669,"Cook, Mr. Jacob",male,53,1970-06-10
CT1670,"Taylor, Mrs. Elmer Zebley (Juliet Cummins Wright)",female,27,2012-05-08
CT1671,"Brown, Mrs. Thomas William Solomon (Elizabeth Catherine Ford)",female,50,1973-05-13
CT1672,"Davidson, Mr. Thornton",male,41,1982-02-19
CT1673,"Mitchell, Mr. Henry Michael",male,80,1944-02-15
CT1674,"Wilhelms, Mr. Charles",male,41,1982-02-19
CT1675,"Watson, Mr. Ennis Hastings",male,27,2012-05-08
CT1676,"Edvardsson, Mr. Gustaf Hjalmar",male,28,1994-10-22
CT1677,"Sawyer, Mr. Frederick Charles",male,34,1988-12-16
CT1678,"Turja, Miss. Anna Sofia",female,28,1994-10-22
CT1679,"Goodwin, Mrs. Frederick (Augusta Tyler)",female,53,1970-06-10
CT1680,"Cardeza, Mr. Thomas Drake Martinez",male,46,1977-04-06
CT1681,"Peters, Miss. Katie",female,27,2012-05-08
CT1682,"Hassab, Mr. Hammad",male,37,1986-01-13
CT1683,"Olsvigen, Mr. Thor Anderson",male,30,1992-11-09
CT1684,"Goodwin, Mr. Charles Edward",male,24,1998-09-15
CT1685,"Brown, Mr. Thomas William Solomon",male,70,1953-11-14
CT1686,"Laroche, Mr. Joseph Philippe Lemercier",male,35,1987-12-26
CT1687,"Panula, Mr. Jaako Arnold",male,24,1998-09-15
CT1688,"Dakic, Mr. Branko",male,29,1993-10-31
CT1689,"Fischer, Mr. Eberhard Thelander",male,28,1994-10-22
CT1690,"Madill, Miss. Georgette Alexandra",female,25,1997-09-24
CT1691,"Dick, Mr. Albert Adrian",male,41,1982-02-19
CT1692,"Karun, Miss. Manca",female,14,2008-06-14
CT1693,"Lam, Mr. Ali",male,27,2012-05-08
CT1694,"Saad, Mr. Khalil",male,35,1987-12-26
CT1695,"Weir, Col. John",male,70,1953-11-14
CT1696,"Chapman, Mr. Charles Henry",male,62,1961-09-01
CT1697,"Kelly, Mr. James",male,54,1969-06-19
CT1698,"Mullens, Miss. Katherine ""Katie""",female,27,2012-05-08
CT1699,"Thayer, Mr. John Borland",male,59,1964-08-04
CT1700,"Humblen, Mr. Adolf Mathias Nicolai Olsen",male,52,1971-06-01
CT1701,"Astor, Mrs. John Jacob (Madeleine Talmadge Force)",female,28,1994-10-22
CT1702,"Silverthorne, Mr. Spencer Victor",male,45,1978-03-28
CT1703,"Barbara, Miss. Saiide",female,28,1994-10-22
CT1704,"Gallagher, Mr. Martin",male,35,1987-12-26
CT1705,"Hansen, Mr. Henrik Juul",male,36,1987-01-04
CT1706,"Morley, Mr. Henry Samuel (""Mr Henry Marshall"")",male,49,1974-05-04
CT1707,"Kelly, Mrs. Florence ""Fannie""",female,55,1968-06-28
CT1708,"Calderhead, Mr. Edward Pennington",male,52,1971-06-01
CT1709,"Cleaver, Miss. Alice",female,32,1990-11-28
CT1710,"Moubarek, Master. Halim Gonios (""William George"")",male,27,2012-05-08
CT1711,"Mayne, Mlle. Berthe Antonine (""Mrs de Villiers"")",female,34,1988-12-16
CT1712,"Klaber, Mr. Herman",male,27,2012-05-08
CT1713,"Taylor, Mr. Elmer Zebley",male,58,1965-07-26
CT1714,"Larsson, Mr. August Viktor",male,39,1984-02-01
CT1715,"Greenberg, Mr. Samuel",male,62,1961-09-01
CT1716,"Soholt, Mr. Peter Andreas Lauritz Andersen",male,29,1993-10-31
CT1717,"Endres, Miss. Caroline Louise",female,48,1975-04-25
CT1718,"Troutt, Miss. Edwina Celia ""Winnie""",female,37,1986-01-13
CT1719,"McEvoy, Mr. Michael",male,27,2012-05-08
CT1720,"Johnson, Mr. Malkolm Joackim",male,43,1980-03-09
CT1721,"Harper, Miss. Annie Jessie ""Nina""",female,16,2006-07-03
CT1722,"Jensen, Mr. Svend Lauritz",male,27,1995-10-13
CT1723,"Gillespie, Mr. William Henry",male,44,1979-03-19
CT1724,"Hodges, Mr. Henry Price",male,60,1963-08-14
CT1725,"Chambers, Mr. Norman Campbell",male,37,1986-01-13
CT1726,"Oreskovic, Mr. Luka",male,30,1992-11-09
CT1727,"Renouf, Mrs. Peter Henry (Lillian Jefferys)",female,40,1983-02-10
CT1728,"Mannion, Miss. Margareth",female,27,2012-05-08
CT1729,"Bryhl, Mr. Kurt Arnold Gottfrid",male,35,1987-12-26
CT1730,"Ilmakangas, Miss. Pieta Sofia",female,35,1987-12-26
CT1731,"Allen, Miss. Elisabeth Walton",female,39,1984-02-01
CT1732,"Hassan, Mr. Houssein G N",male,21,2001-08-18
CT1733,"Knight, Mr. Robert J",male,27,2012-05-08
CT1734,"Berriman, Mr. William John",male,33,1989-12-07
CT1735,"Troupiansky, Mr. Moses Aaron",male,33,1989-12-07
CT1736,"Williams, Mr. Leslie",male,38,1985-01-22
CT1737,"Ford, Mrs. Edward (Margaret Ann Watson)",female,58,1965-07-26
CT1738,"Lesurer, Mr. Gustave J",male,45,1978-03-28
CT1739,"Ivanoff, Mr. Kanio",male,27,2012-05-08
CT1740,"Nankoff, Mr. Minko",male,27,2012-05-08
CT1741,"Hawksford, Mr. Walter James",male,27,2012-05-08
CT1742,"Cavendish, Mr. Tyrell William",male,46,1977-04-06
CT1743,"Ryerson, Miss. Susan Parker ""Suzette""",female,31,1991-11-19
CT1744,"McNamee, Mr. Neal",male,34,1988-12-16
CT1745,"Stranden, Mr. Juho",male,41,1982-02-19
CT1746,"Crosby, Capt. Edward Gifford",male,80,1944-02-15
CT1747,"Abbott, Mr. Rossmore Edward",male,26,1996-10-03
CT1748,"Sinkkonen, Miss. Anna",female,40,1983-02-10
CT1749,"Marvin, Mr. Daniel Warner",male,29,1993-10-31
CT1750,"Connaghton, Mr. Michael",male,41,1982-02-19
CT1751,"Wells, Miss. Joan",female,14,2008-06-14
CT1752,"Moor, Master. Meier",male,16,2006-07-03
CT1753,"Vande Velde, Mr. Johannes Joseph",male,43,1980-03-09
CT1754,"Jonkoff, Mr. Lalio",male,33,1989-12-07
CT1755,"Herman, Mrs. Samuel (Jane Laver)",female,58,1965-07-26
CT1756,"Hamalainen, Master. Viljo",male,27,2012-05-08
CT1757,"Carlsson, Mr. August Sigfrid",male,38,1985-01-22
CT1758,"Bailey, Mr. Percy Andrew",male,28,1994-10-22
CT1759,"Theobald, Mr. Thomas Leonard",male,44,1979-03-19
CT1760,"Rothes, the Countess. of (Lucy Noel Martha Dyer-Edwards)",female,43,1980-03-09
CT1761,"Garfirth, Mr. John",male,27,2012-05-08
CT1762,"Nirva, Mr. Iisakki Antino Aijo",male,51,1972-05-22
CT1763,"Barah, Mr. Hanna Assi",male,30,1992-11-09
CT1764,"Carter, Mrs. William Ernest (Lucile Polk)",female,46,1977-04-06
CT1765,"Eklund, Mr. Hans Linus",male,26,1996-10-03
CT1766,"Hogeboom, Mrs. John C (Anna Andrews)",female,61,1962-08-23
CT1767,"Brewe, Dr. Arthur Jackson",male,27,2012-05-08
CT1768,"Mangan, Miss. Mary",female,40,1983-02-10
CT1769,"Moran, Mr. Daniel J",male,27,2012-05-08
CT1770,"Gronnestad, Mr. Daniel Danielsen",male,42,1981-02-28
CT1771,"Lievens, Mr. Rene Aime",male,34,1988-12-16
CT1772,"Jensen, Mr. Niels Peder",male,58,1965-07-26
CT1773,"Mack, Mrs. (Mary)",female,67,1956-10-17
CT1774,"Elias, Mr. Dibo",male,27,2012-05-08
CT1775,"Hocking, Mrs. Elizabeth (Eliza Needs)",female,64,1959-09-20
CT1776,"Myhrman, Mr. Pehr Fabian Oliver Malkolm",male,28,1994-10-22
CT1777,"Tobin, Mr. Roger",male,27,2012-05-08
CT1778,"Emanuel, Miss. Virginia Ethel",female,15,2007-06-24
CT1779,"Kilgannon, Mr. Thomas J",male,27,2012-05-08
CT1780,"Robert, Mrs. Edward Scott (Elisabeth Walton McMillan)",female,53,1970-06-10
CT1781,"Ayoub, Miss. Banoura",female,23,1999-09-06
CT1782,"Dick, Mrs. Albert Adrian (Vera Gillespie)",female,27,1995-10-13
CT1783,"Long, Mr. Milton Clyde",male,39,1984-02-01
CT1784,"Johnston, Mr. Andrew G",male,27,2012-05-08
CT1785,"Ali, Mr. William",male,35,1987-12-26
CT1786,"Harmer, Mr. Abraham (David Lishin)",male,35,1987-12-26
CT1787,"Sjoblom, Miss. Anna Sofia",female,28,1994-10-22
CT1788,"Rice, Master. George Hugh",male,18,2004-07-21
CT1789,"Dean, Master. Bertram Vere",male,11,2011-05-18
CT1790,"Guggenheim, Mr. Benjamin",male,56,1967-07-08
CT1791,"Keane, Mr. Andrew ""Andy""",male,27,2012-05-08
CT1792,"Gaskell, Mr. Alfred",male,26,1996-10-03
CT1793,"Sage, Miss. Stella Anna",female,27,2012-05-08
CT1794,"Hoyt, Mr. William Fisher",male,27,2012-05-08
CT1795,"Dantcheff, Mr. Ristiu",male,35,1987-12-26
CT1796,"Otter, Mr. Richard",male,49,1974-05-04
CT1797,"Leader, Dr. Alice (Farnham)",female,59,1964-08-04
CT1798,"Osman, Mrs. Mara",female,41,1982-02-19
CT1799,"Ibrahim Shawah, Mr. Yousseff",male,40,1983-02-10
CT1800,"Van Impe, Mrs. Jean Baptiste (Rosalie Paula Govaert)",female,40,1983-02-10
CT1801,"Ponesell, Mr. Martin",male,44,1979-03-19
CT1802,"Collyer, Mrs. Harvey (Charlotte Annie Tate)",female,41,1982-02-19
CT1803,"Carter, Master. William Thornton II",male,21,2001-08-18
CT1804,"Thomas, Master. Assad Alexander",male,27,2012-05-08
CT1805,"Hedman, Mr. Oskar Arvid",male,37,1986-01-13
CT1806,"Johansson, Mr. Karl Johan",male,41,1982-02-19
CT1807,"Andrews, Mr. Thomas Jr",male,49,1974-05-04
CT1808,"Pettersson, Miss. Ellen Natalia",female,28,1994-10-22
CT1809,"Meyer, Mr. August",male,49,1974-05-04
CT1810,"Chambers, Mrs. Norman Campbell (Bertha Griggs)",female,43,1980-03-09
CT1811,"Alexander, Mr. William",male,36,1987-01-04
CT1812,"Lester, Mr. James",male,49,1974-05-04
CT1813,"Slemen, Mr. Richard James",male,45,1978-03-28
CT1814,"Andersson, Miss. Ebba Iris Alfrida",female,16,2006-07-03
CT1815,"Tomlin, Mr. Ernest Portage",male,40,1983-02-10
CT1816,"Fry, Mr. Richard",male,27,2012-05-08
CT1817,"Heininen, Miss. Wendla Maria",female,33,1989-12-07
CT1818,"Mallet, Mr. Albert",male,41,1982-02-19
CT1819,"Holm, Mr. John Fredrik Alexander",male,53,1970-06-10
CT1820,"Skoog, Master. Karl Thorsten",male,20,2002-08-09
CT1821,"Hays, Mrs. Charles Melville (Clara Jennings Gregg)",female,62,1961-09-01
CT1822,"Lulic, Mr. Nikola",male,37,1986-01-13
CT1823,"Reuchlin, Jonkheer. John George",male,48,1975-04-25
CT1824,"Moor, Mrs. (Beila)",female,37,1986-01-13
CT1825,"Panula, Master. Urho Abraham",male,12,2010-05-27
CT1826,"Flynn, Mr. John",male,27,2012-05-08
CT1827,"Lam, Mr. Len",male,27,2012-05-08
CT1828,"Mallet, Master. Andre",male,11,2011-05-18
CT1829,"McCormack, Mr. Thomas Joseph",male,27,2012-05-08
CT1830,"Stone, Mrs. George Nelson (Martha Evelyn)",female,72,1951-12-03
CT1831,"Yasbeck, Mrs. Antoni (Selini Alexander)",female,25,1997-09-24
CT1832,"Richards, Master. George Sibley",male,27,2012-05-08
CT1833,"Saad, Mr. Amin",male,27,2012-05-08
CT1834,"Augustsson, Mr. Albert",male,33,1989-12-07
CT1835,"Allum, Mr. Owen George",male,28,1994-10-22
CT1836,"Compton, Miss. Sara Rebecca",female,49,1974-05-04
CT1837,"Pasic, Mr. Jakob",male,31,1991-11-19
CT1838,"Sirota, Mr. Maurice",male,27,2012-05-08
CT1839,"Chip, Mr. Chang",male,42,1981-02-28
CT1840,"Marechal, Mr. Pierre",male,27,2012-05-08
CT1841,"Alhomaki, Mr. Ilmari Rudolf",male,30,1992-11-09
CT1842,"Mudd, Mr. Thomas Charles",male,26,1996-10-03
CT1843,"Serepeca, Miss. Augusta",female,40,1983-02-10
CT1844,"Lemberopolous, Mr. Peter L",male,44,1979-03-19
CT1845,"Culumovic, Mr. Jeso",male,27,1995-10-13
CT1846,"Abbing, Mr. Anthony",male,52,1971-06-01
CT1847,"Sage, Mr. Douglas Bullen",male,27,2012-05-08
CT1848,"Markoff, Mr. Marin",male,45,1978-03-28
CT1849,"Harper, Rev. John",male,38,1985-01-22
CT1850,"Goldenberg, Mrs. Samuel L (Edwiga Grabowska)",female,27,2012-05-08
CT1851,"Andersson, Master. Sigvard Harald Elias",male,14,2008-06-14
CT1852,"Svensson, Mr. Johan",male,84,1940-03-23
CT1853,"Boulos, Miss. Nourelain",female,19,2003-07-31
CT1854,"Lines, Miss. Mary Conover",female,26,1996-10-03
CT1855,"Carter, Mrs. Ernest Courtenay (Lilian Hughes)",female,54,1969-06-19
CT1856,"Aks, Mrs. Sam (Leah Rosen)",female,28,1994-10-22
CT1857,"Wick, Mrs. George Dennick (Mary Hitchcock)",female,55,1968-06-28
CT1858,"Daly, Mr. Peter Denis ",male,61,1962-08-23
CT1859,"Baclini, Mrs. Solomon (Latifa Qurban)",female,34,1988-12-16
CT1860,"Razi, Mr. Raihed",male,27,2012-05-08
CT1861,"Hansen, Mr. Claus Peter",male,51,1972-05-22
CT1862,"Giles, Mr. Frederick Edward",male,31,1991-11-19
CT1863,"Swift, Mrs. Frederick Joel (Margaret Welles Barron)",female,58,1965-07-26
CT1864,"Sage, Miss. Dorothy Edith ""Dolly""",female,27,2012-05-08
CT1865,"Gill, Mr. John William",male,34,1988-12-16
CT1866,"Bystrom, Mrs. (Karolina)",female,52,1971-06-01
CT1867,"Duran y More, Miss. Asuncion",female,37,1986-01-13
CT1868,"Roebling, Mr. Washington Augustus II",male,41,1982-02-19
CT1869,"van Melkebeke, Mr. Philemon",male,27,2012-05-08
CT1870,"Johnson, Master. Harold Theodor",male,14,2008-06-14
CT1871,"Balkic, Mr. Cerin",male,36,1987-01-04
CT1872,"Beckwith, Mrs. Richard Leonard (Sallie Monypeny)",female,57,1966-07-17
CT1873,"Carlsson, Mr. Frans Olof",male,43,1980-03-09
CT1874,"Vander Cruyssen, Mr. Victor",male,57,1966-07-17
CT1875,"Abelson, Mrs. Samuel (Hannah Wizosky)",female,38,1985-01-22
CT1876,"Najib, Miss. Adele Kiamie ""Jane""",female,25,1997-09-24
CT1877,"Gustafsson, Mr. Alfred Ossian",male,30,1992-11-09
CT1878,"Petroff, Mr. Nedelio",male,29,1993-10-31
CT1879,"Laleff, Mr. Kristo",male,27,2012-05-08
CT1880,"Potter, Mrs. Thomas Jr (Lily Alexenia Wilson)",female,66,1957-10-08
CT1881,"Shelley, Mrs. William (Imanita Parrish Hall)",female,35,1987-12-26
CT1882,"Markun, Mr. Johann",male,43,1980-03-09
CT1883,"Dahlberg, Miss. Gerda Ulrika",female,32,1990-11-28
CT1884,"Banfield, Mr. Frederick James",male,38,1985-01-22
CT1885,"Sutehall, Mr. Henry Jr",male,35,1987-12-26
CT1886,"Rice, Mrs. William (Margaret Norton)",female,49,1974-05-04
CT1887,"Montvila, Rev. Juozas",male,37,1986-01-13
CT1888,"Graham, Miss. Margaret Edith",female,29,1993-10-31
CT1889,"Johnston, Miss. Catherine Helen ""Carrie""",female,27,2012-05-08
CT1890,"Behr, Mr. Karl Howell",male,36,1987-01-04
CT1891,"Dooley, Mr. Patrick",male,42,1981-02-28
